{
  "version": "1.0",
  "timestamp": "2026-09-18T13:56:00Z",
  "mumei_version": "0.6.19",
  "z3_version": "4.8.12",
  "file": "defi/invariants.mm",
  "atoms": [
    {
      "name": "cei_compliant_withdraw",
      "z3_check_result": "unknown",
      "content_hash": "9d1f4f2d0a4f6c1f0a9b8e7d6c5b4a39383726150403f2e1d0c9b8a7968574635",
      "status": "unknown",
      "spec_validation_result": {
        "status": "satisfiable",
        "is_satisfiable": true,
        "trace_id": null,
        "spec_metadata": {
          "source_file": "defi/invariants.mm"
        },
        "traceability_hash": "3b5f2a8c1d4e6f708192a3b4c5d6e7f8091a2b3c4d5e6f708192a3b4c5d6e7f8",
        "traceability_coverage": 0.75,
        "checked_requires": true,
        "checked_ensures": 1,
        "checked_refinements": 0,
        "ensures_implication_checks": 1,
        "diagnostics": []
      },
      "proof_hash": "7e3a1b9c4d5f6e7081a2b3c4d5e6f708192a3b4c5d6e7f8091a2b3c4d5e6f708",
      "dependencies": [],
      "effects": ["Vault"],
      "effect_pre": { "Vault": "Idle" },
      "effect_post": { "Vault": "Interacted" },
      "requires": "balance >= 0 && balance <= 1000000000 && amount > 0 && balance >= amount",
      "ensures": "result == balance - amount && result >= 0",
      "body_expr": "{\n    perform Vault.check;\n    perform Vault.update;\n    perform Vault.interact;\n    balance - amount\n}",
      "body_summary": "{ perform Vault.check; perform Vault.update; perform Vault.interact; balance - amount }",
      "z3_result_class": "unknown",
      "logic_fragment_tag": "linear_arithmetic",
      "logic_fragment_tags": [],
      "translator_version": "mumei-lean-translator-ir-v2",
      "binder_mapping": {
        "balance": "balance",
        "amount": "amount",
        "result": "result"
      },
      "bridge_lemma_hash": "ee8cd3ba96c3318b3f07445f4755619744d4e1f9a662af94f3cbce6d41ed4347",
      "translator_ir": {
        "sort": "refinement_predicate",
        "binders": [
          {
            "mumei_name": "balance",
            "lean_name": "balance",
            "mumei_type": "i64",
            "lean_type": "Int",
            "role": "param"
          },
          {
            "mumei_name": "amount",
            "lean_name": "amount",
            "mumei_type": "i64",
            "lean_type": "Int",
            "role": "param"
          },
          {
            "mumei_name": "result",
            "lean_name": "result",
            "mumei_type": "i64",
            "lean_type": "Int",
            "role": "result"
          }
        ],
        "theorem_goal": "(balance >= 0 && balance <= 1000000000 && amount > 0 && balance >= amount) -> (result == balance - amount && result >= 0)",
        "provenance_span": {
          "file": "defi/invariants.mm",
          "line": 12,
          "col": 1,
          "len": 4
        },
        "lowering_rules": [
          "contract_lowering",
          "type_system_mapping"
        ],
        "semantic_gap_notes": [],
        "proof_trace_hints": [],
        "requires_bridge_lemmas": []
      },
      "symbol_provenance": [],
      "solver_process_metadata": {
        "task_id": null,
        "cache_key": "5a4b3c2d1e0f9a8b7c6d5e4f3a2b1c0d9e8f7a6b5c4d3e2f1a0b9c8d7e6f5a4b",
        "generation_id": "",
        "solver_config_fingerprint": "4eb8092c0cb08dd4c8d6494173a480c7fae3ce88feef61311d32f80092aad8dc",
        "timeout_ms": 10000,
        "cancel_reason": null,
        "process_start_time": "",
        "process_end_time": "2026-09-18T13:56:00Z"
      }
    },
    {
      "name": "guarded_state_update",
      "z3_check_result": "unknown",
      "content_hash": "1f2e3d4c5b6a7980717263544536271809aabbccddeeff0011223344556677889",
      "status": "unknown",
      "spec_validation_result": {
        "status": "satisfiable",
        "is_satisfiable": true,
        "trace_id": null,
        "spec_metadata": {
          "source_file": "defi/invariants.mm"
        },
        "traceability_hash": "6c5d4e3f2a1b099887766554433221100ffeeddccbbaa9988776655443322110",
        "traceability_coverage": 0.75,
        "checked_requires": true,
        "checked_ensures": 1,
        "checked_refinements": 0,
        "ensures_implication_checks": 1,
        "diagnostics": []
      },
      "proof_hash": "2b3c4d5e6f708192a3b4c5d6e7f8091a2b3c4d5e6f708192a3b4c5d6e7f8091a",
      "dependencies": [],
      "effects": ["Vault"],
      "effect_pre": { "Vault": "Checked" },
      "effect_post": { "Vault": "Effected" },
      "requires": "balance >= 0 && balance <= 1000000000 && amount > 0 && balance >= amount",
      "ensures": "result == balance - amount",
      "body_expr": "{\n    perform Vault.update;\n    balance - amount\n}",
      "body_summary": "{ perform Vault.update; balance - amount }",
      "z3_result_class": "unknown",
      "logic_fragment_tag": "linear_arithmetic",
      "logic_fragment_tags": [],
      "translator_version": "mumei-lean-translator-ir-v2",
      "binder_mapping": {
        "balance": "balance",
        "amount": "amount",
        "result": "result"
      },
      "bridge_lemma_hash": "ee8cd3ba96c3318b3f07445f4755619744d4e1f9a662af94f3cbce6d41ed4347",
      "translator_ir": {
        "sort": "refinement_predicate",
        "binders": [
          {
            "mumei_name": "balance",
            "lean_name": "balance",
            "mumei_type": "i64",
            "lean_type": "Int",
            "role": "param"
          },
          {
            "mumei_name": "amount",
            "lean_name": "amount",
            "mumei_type": "i64",
            "lean_type": "Int",
            "role": "param"
          },
          {
            "mumei_name": "result",
            "lean_name": "result",
            "mumei_type": "i64",
            "lean_type": "Int",
            "role": "result"
          }
        ],
        "theorem_goal": "(balance >= 0 && balance <= 1000000000 && amount > 0 && balance >= amount) -> (result == balance - amount)",
        "provenance_span": {
          "file": "defi/invariants.mm",
          "line": 24,
          "col": 1,
          "len": 4
        },
        "lowering_rules": [
          "contract_lowering",
          "type_system_mapping"
        ],
        "semantic_gap_notes": [],
        "proof_trace_hints": [],
        "requires_bridge_lemmas": []
      },
      "symbol_provenance": [],
      "solver_process_metadata": {
        "task_id": null,
        "cache_key": "aabbccddeeff001122334455667788990a1b2c3d4e5f6a7b8c9d0e1f2a3b4c5d6",
        "generation_id": "",
        "solver_config_fingerprint": "4eb8092c0cb08dd4c8d6494173a480c7fae3ce88feef61311d32f80092aad8dc",
        "timeout_ms": 10000,
        "cancel_reason": null,
        "process_start_time": "",
        "process_end_time": "2026-09-18T13:56:00Z"
      }
    }
  ],
  "certificate_hash": "8f7e6d5c4b3a29180716253445566778899aabbccddeeff001122334455667788",
  "all_verified": true
}
