{
  "version": "1.0",
  "timestamp": "2026-05-05T00:00:00Z",
  "mumei_version": "0.6.12",
  "z3_version": "Z3 version 4.12.2",
  "file": "std/math/abs.mm",
  "atoms": [
    {
      "name": "abs_saturating",
      "z3_check_result": "unknown",
      "content_hash": "0000000000000000000000000000000000000000000000000000000000000000",
      "status": "unknown",
      "proof_hash": "0000000000000000000000000000000000000000000000000000000000000000",
      "dependencies": [],
      "effects": [],
      "requires": "true",
      "ensures": "result >= 0",
      "body_summary": "absolute value saturating at i64::MAX when x is i64::MIN",
      "body_expr": "if x == (0 - 9223372036854775807 - 1) then 9223372036854775807 else if x >= 0 then x else 0 - x",
      "translator_version": "mumei-lean-translator-ir-v2",
      "bridge_lemma_hash": "5716cfdd945d68b4a0d75d75c5ade1934cbd76e0dfe16734a8f3dd723cfdd8e9"
    }
  ],
  "package_name": "std",
  "package_version": "0",
  "certificate_hash": "",
  "all_verified": false
}
